{
  "api_version": "tekmovela.io/v1alpha1",
  "kind": "CoverageStatement",
  "id": "coverage.checkout.v2",
  "subject_ref": "release.checkout.v2",
  "covered_criteria": ["checkout.atomicity", "checkout.concurrency"],
  "excluded_criteria": ["checkout.regulatory"],
  "coverage_debt_refs": ["debt.checkout.concurrency"],
  "environment_scope": "staging-1"
}
